{
  "id": "ea in enim Lorem",
  "lastModificationDateTime": "1955-06-07T22:51:24.624Z",
  "goodsReceiptDate": "Ut tempor minim",
  "nativeId": "ea incididunt sit",
  "exported": false,
  "auditDetail": {
    "createdOn": "1954-07-27T20:24:50.436Z",
    "createdBy": "pariatur",
    "updatedOn": "1999-10-26T10:49:00.605Z",
    "updatedBy": "dolore esse sed",
    "isDeleted": false
  },
  "items": [
    "aute occaecat qui nisi exercitation",
    "Ut culpa velit in reprehenderit"
  ],
  "number": "nisi est nulla irure",
  "postingDate": "proident incididunt aute sunt ad"
}